{
  "schemaVersion": 1,
  "artifacts": [
    {
      "id": "node",
      "version": "24.21.0",
      "url": "https://nodejs.org/dist/v24.21.0/node-v24.21.0-darwin-arm64.tar.gz",
      "sha256": "bed7eea5325e1108f32ce5228ddd6a5f0f08a499ee42aa7442aea583702f6057",
      "os": "darwin",
      "arch": "arm64",
      "type": "tar.gz",
      "executable": "node-v24.21.0-darwin-arm64/bin/node",
      "allowedHosts": [
        "nodejs.org"
      ],
      "license": "MIT and bundled notices",
      "consentRequired": false
    },
    {
      "id": "java",
      "version": "21.0.12+101.0.LTS",
      "url": "https://github.com/adoptium/temurin21-binaries/releases/download/jdk-21.0.12.1%2B1/OpenJDK21U-jre_aarch64_mac_hotspot_21.0.12.1_1.tar.gz",
      "sha256": "dec50fc6f9fcd4fe3ae8cabf5a5fa68f6afc48841f7698e468e9aa5d54beed84",
      "os": "darwin",
      "arch": "arm64",
      "type": "tar.gz",
      "executable": "jdk-21.0.12.1+1-jre/Contents/Home/bin/java",
      "allowedHosts": [
        "github.com",
        "release-assets.githubusercontent.com",
        "objects.githubusercontent.com"
      ],
      "license": "GPL-2.0-with-classpath-exception",
      "consentRequired": false
    },
    {
      "id": "sqlcl",
      "version": "26.1.2.132.1334",
      "url": "https://download.oracle.com/otn_software/java/sqldeveloper/sqlcl-26.1.2.132.1334.zip",
      "sha256": "46acb619eac04c70ed9b0d50eb9638237d302f35f59dc358d357d01f1ebb0756",
      "os": "darwin",
      "arch": "arm64",
      "type": "zip",
      "executable": "sqlcl/bin/sql",
      "allowedHosts": [
        "download.oracle.com"
      ],
      "license": "https://www.oracle.com/downloads/licenses/oracle-free-license.html",
      "consentRequired": true
    },
    {
      "id": "node",
      "version": "24.21.0",
      "url": "https://nodejs.org/dist/v24.21.0/node-v24.21.0-linux-x64.tar.gz",
      "sha256": "6e1db87ef58b8819e5d5402eff1536491b18edd8eb7bee5ef7897876e88dc5ff",
      "os": "linux",
      "arch": "x64",
      "type": "tar.gz",
      "executable": "node-v24.21.0-linux-x64/bin/node",
      "allowedHosts": [
        "nodejs.org"
      ],
      "license": "MIT and bundled notices",
      "consentRequired": false
    },
    {
      "id": "java",
      "version": "21.0.12+101.0.LTS",
      "url": "https://github.com/adoptium/temurin21-binaries/releases/download/jdk-21.0.12.1%2B1/OpenJDK21U-jre_x64_linux_hotspot_21.0.12.1_1.tar.gz",
      "sha256": "2413149700df0f7d440500a84a8f764c535f21e5a5e87d38328b64eec2c5b500",
      "os": "linux",
      "arch": "x64",
      "type": "tar.gz",
      "executable": "jdk-21.0.12.1+1-jre/bin/java",
      "allowedHosts": [
        "github.com",
        "release-assets.githubusercontent.com",
        "objects.githubusercontent.com"
      ],
      "license": "GPL-2.0-with-classpath-exception",
      "consentRequired": false
    },
    {
      "id": "sqlcl",
      "version": "26.1.2.132.1334",
      "url": "https://download.oracle.com/otn_software/java/sqldeveloper/sqlcl-26.1.2.132.1334.zip",
      "sha256": "46acb619eac04c70ed9b0d50eb9638237d302f35f59dc358d357d01f1ebb0756",
      "os": "linux",
      "arch": "x64",
      "type": "zip",
      "executable": "sqlcl/bin/sql",
      "allowedHosts": [
        "download.oracle.com"
      ],
      "license": "https://www.oracle.com/downloads/licenses/oracle-free-license.html",
      "consentRequired": true
    },
    {
      "id": "node",
      "version": "24.21.0",
      "url": "https://nodejs.org/dist/v24.21.0/node-v24.21.0-win-x64.zip",
      "sha256": "158f7685b44de51f6c0df1d153526cbcd3e1bc739a8dfc607721cef75de9e541",
      "os": "win32",
      "arch": "x64",
      "type": "zip",
      "executable": "node-v24.21.0-win-x64/node.exe",
      "allowedHosts": [
        "nodejs.org"
      ],
      "license": "MIT and bundled notices",
      "consentRequired": false
    },
    {
      "id": "java",
      "version": "21.0.12+101.0.LTS",
      "url": "https://github.com/adoptium/temurin21-binaries/releases/download/jdk-21.0.12.1%2B1/OpenJDK21U-jre_x64_windows_hotspot_21.0.12.1_1.zip",
      "sha256": "d35f31e712f0fcf6ac5a093edc90204fbff22f720ba3950bd09d331d5e621636",
      "os": "win32",
      "arch": "x64",
      "type": "zip",
      "executable": "jdk-21.0.12.1+1-jre/bin/java.exe",
      "allowedHosts": [
        "github.com",
        "release-assets.githubusercontent.com",
        "objects.githubusercontent.com"
      ],
      "license": "GPL-2.0-with-classpath-exception",
      "consentRequired": false
    },
    {
      "id": "sqlcl",
      "version": "26.1.2.132.1334",
      "url": "https://download.oracle.com/otn_software/java/sqldeveloper/sqlcl-26.1.2.132.1334.zip",
      "sha256": "46acb619eac04c70ed9b0d50eb9638237d302f35f59dc358d357d01f1ebb0756",
      "os": "win32",
      "arch": "x64",
      "type": "zip",
      "executable": "sqlcl/bin/sql.exe",
      "allowedHosts": [
        "download.oracle.com"
      ],
      "license": "https://www.oracle.com/downloads/licenses/oracle-free-license.html",
      "consentRequired": true
    }
  ],
  "playwright": {
    "version": "1.63.0",
    "browsers": [
      {
        "name": "chromium",
        "revision": "1243",
        "installByDefault": true,
        "browserVersion": "153.0.8010.12",
        "title": "Chrome for Testing"
      },
      {
        "name": "chromium-headless-shell",
        "revision": "1243",
        "installByDefault": true,
        "browserVersion": "153.0.8010.12",
        "title": "Chrome Headless Shell"
      },
      {
        "name": "firefox",
        "revision": "1543",
        "installByDefault": true,
        "browserVersion": "155.0",
        "title": "Firefox"
      },
      {
        "name": "webkit",
        "revision": "2359",
        "installByDefault": true,
        "revisionOverrides": {
          "mac14": "2251",
          "mac14-arm64": "2251"
        },
        "browserVersion": "26.6",
        "title": "WebKit"
      },
      {
        "name": "ffmpeg",
        "revision": "1011",
        "installByDefault": true
      },
      {
        "name": "winldd",
        "revision": "1007",
        "installByDefault": false
      },
      {
        "name": "android",
        "revision": "1001",
        "installByDefault": false
      }
    ]
  },
  "provenance": {
    "retrievedAt": "2026-09-12",
    "node": "https://nodejs.org/dist/v24.21.0/SHASUMS256.txt",
    "java": "https://api.adoptium.net/v3/assets/feature_releases/21/ga",
    "sqlcl": "SHA-256 measured from the downloaded versioned vendor artifact; not a vendor signature"
  }
}
